{
  "id": "https://example.org/rim/r",
  "type": "Register",
  "objectIdentifier": "urn:uuid:11111111-1111-4111-8111-111111111111",
  "functionalIdentifier": "https://example.org/registers/units",
  "title": "Register of Units",
  "description": "Units of measure in use across the organisation's datasets.",
  "runsOn": {
    "id": "https://example.org/rim/sys",
    "type": "RegisterSystem",
    "label": "Units register system"
  },
  "registerOwner": {
    "id": "https://example.org/org/metrology",
    "type": "Organization",
    "label": "Metrology office"
  },
  "registerManager": "https://example.org/org/metrology",
  "controlBody": "https://example.org/org/units-panel"
}